{
  "deck_id": "piti_deck_plan_ai_knowledge_institution",
  "source_storyline_id": "anny_storyline_ai_knowledge_institution_enriched_v1",
  "source_storyline_path": "outputs/model_dry_runs/anny_storyline/ai_knowledge_institution_gpt_pro_storyline_enriched.json",
  "title": "AI 즉답 시대의 지식기관 역할",
  "theme": "syuka_default_v0",
  "length_mode": "representative_storyboard",
  "target_slide_count": 26,
  "sections": [
    {
      "section_no": 1,
      "section_title": "AI가 답을 바로 주는 시대",
      "purpose": "AI 즉답의 편리함과 Royal Observatory의 경고를 hook으로 제시한다.",
      "target_slide_count": 6,
      "slides": [
        {
          "slide_no": 1,
          "section_no": 1,
          "local_order": 1,
          "source_slide_refs": [
            1
          ],
          "slide_type": "title",
          "layout_type": "title",
          "layout": "title",
          "headline": "AI 즉답 시대의 지식기관 역할",
          "body": [
            "검색창이 아니라 답안지가 된 AI",
            "학교와 박물관은 이제 무엇을 가르쳐야 할까"
          ],
          "visual_plan": {
            "kind": "manual",
            "description": "Manual visual placeholder; choose asset during later Piti/PPT work.",
            "source_note": null,
            "copyright_risk": false,
            "manual_check_required": true,
            "prompt_if_ai_image": null
          },
          "image_slots": [],
          "source_urls": [],
          "image_urls": [],
          "speaker_notes": "[제목] dry run representative outline. 이미지 후보: 검색창/천문관/관람객 대비 이미지. [이미지] 필요 시 별도 선정.",
          "notes": "[제목] dry run representative outline. 이미지 후보: 검색창/천문관/관람객 대비 이미지. [이미지] 필요 시 별도 선정.",
          "needs_source": false,
          "needs_fact_check": false,
          "required_before_broadcast": false,
          "fact_check_kind": null,
          "fact_check_priority": null,
          "risk_flags": [],
          "edit_notes": []
        },
        {
          "slide_no": 2,
          "section_no": 1,
          "local_order": 2,
          "source_slide_refs": [
            2
          ],
          "slide_type": "hook",
          "layout_type": "big_headline",
          "layout": "big_headline",
          "headline": "AI가 답을 바로 주는 건 정말 편리하다",
          "body": [
            "모르는 것을 물으면 바로 답이 나오고, 검색 결과를 여러 개 열어보던 시간이 줄어든다",
            "AI는 접근성과 개인화 가능성도 넓힐 수 있다",
            "다만 편리함이 곧 배움이라는 뜻은 아니므로, 정보 탐색 과정의 변화로 조심스럽게 다룬다"
          ],
          "visual_plan": {
            "kind": "manual",
            "description": "Manual visual placeholder; choose asset during later Piti/PPT work.",
            "source_note": "https://www.microsoft.com/en-us/research/publication/from-searchable-to-non-searchable-generative-ai-and-information-diversity-in-online-information-seeking/; https://www.unesco.org/en/articles/ai-and-education-protecting-rights-learners",
            "copyright_risk": false,
            "manual_check_required": true,
            "prompt_if_ai_image": null
          },
          "image_slots": [],
          "source_urls": [
            "https://www.microsoft.com/en-us/research/publication/from-searchable-to-non-searchable-generative-ai-and-information-diversity-in-online-information-seeking/",
            "https://www.unesco.org/en/articles/ai-and-education-protecting-rights-learners"
          ],
          "image_urls": [],
          "speaker_notes": "[내용] Microsoft Research — generative AI and information diversity. [반대관점] UNESCO — AI can support access/personalized learning if rights and safeguards are respected. [주의] 사용률/효과 수치 단정 금지.\n[내용] https://www.microsoft.com/en-us/research/publication/from-searchable-to-non-searchable-generative-ai-and-information-diversity-in-online-information-seeking/\n[내용] https://www.unesco.org/en/articles/ai-and-education-protecting-rights-learners\n[TODO] needs_fact_check=true: claim must be manually checked.",
          "notes": "[내용] Microsoft Research — generative AI and information diversity. [반대관점] UNESCO — AI can support access/personalized learning if rights and safeguards are respected. [주의] 사용률/효과 수치 단정 금지.\n[내용] https://www.microsoft.com/en-us/research/publication/from-searchable-to-non-searchable-generative-ai-and-information-diversity-in-online-information-seeking/\n[내용] https://www.unesco.org/en/articles/ai-and-education-protecting-rights-learners\n[TODO] needs_fact_check=true: claim must be manually checked.",
          "needs_source": false,
          "needs_fact_check": true,
          "required_before_broadcast": false,
          "fact_check_kind": null,
          "fact_check_priority": null,
          "risk_flags": [
            "single_source_dependency"
          ],
          "edit_notes": []
        },
        {
          "slide_no": 3,
          "section_no": 1,
          "local_order": 3,
          "source_slide_refs": [
            3
          ],
          "slide_type": "quote",
          "layout_type": "quote",
          "layout": "quote",
          "headline": "영국 왕립천문대 쪽에서 나온 경고",
          "body": [
            "BBC 보도는 Royal Observatory 쪽 경고를 AI 의존과 인간 지식의 역할이라는 맥락에서 소개한다",
            "이 메시지는 AI 금지가 아니라, 답을 받는 사람이 무엇을 배워야 하느냐는 질문으로 읽는다",
            "단일 기관 사례이므로 모든 지식기관의 공식 입장처럼 일반화하지 않는다"
          ],
          "visual_plan": {
            "kind": "manual",
            "description": "Manual visual placeholder; choose asset during later Piti/PPT work.",
            "source_note": "https://www.bbc.com/news/articles/c2023l60370o?at_medium=RSS&at_campaign=rss",
            "copyright_risk": false,
            "manual_check_required": true,
            "prompt_if_ai_image": null
          },
          "image_slots": [],
          "source_urls": [
            "https://www.bbc.com/news/articles/c2023l60370o?at_medium=RSS&at_campaign=rss"
          ],
          "image_urls": [],
          "speaker_notes": "[내용] BBC / Royal Observatory article. [주의] Royal Observatory 발언을 전체 교육계 입장으로 확대하지 말 것.\n[내용] https://www.bbc.com/news/articles/c2023l60370o?at_medium=RSS&at_campaign=rss\n[TODO] needs_fact_check=true: claim must be manually checked.",
          "notes": "[내용] BBC / Royal Observatory article. [주의] Royal Observatory 발언을 전체 교육계 입장으로 확대하지 말 것.\n[내용] https://www.bbc.com/news/articles/c2023l60370o?at_medium=RSS&at_campaign=rss\n[TODO] needs_fact_check=true: claim must be manually checked.",
          "needs_source": false,
          "needs_fact_check": true,
          "required_before_broadcast": false,
          "fact_check_kind": null,
          "fact_check_priority": null,
          "risk_flags": [
            "single_source_dependency"
          ],
          "edit_notes": []
        },
        {
          "slide_no": 4,
          "section_no": 1,
          "local_order": 4,
          "source_slide_refs": [
            4
          ],
          "slide_type": "explainer",
          "layout_type": "headline_body",
          "layout": "headline_body",
          "headline": "천문대가 왜 이런 말을 했을까",
          "body": [
            "천문학은 답 하나보다 관찰·추론·검증의 과정이 중요한 분야다",
            "AI 즉답은 그 과정을 도와줄 수도, 일부 건너뛰게 만들 수도 있다",
            "여기서는 사실 증명보다 방송용 문제 제기: 도구가 답을 줄 때 사람의 관찰은 어디에 남는가"
          ],
          "visual_plan": {
            "kind": "manual",
            "description": "Manual visual placeholder; choose asset during later Piti/PPT work.",
            "source_note": "https://www.bbc.com/news/articles/c2023l60370o?at_medium=RSS&at_campaign=rss; https://www.microsoft.com/en-us/research/publication/from-searchable-to-non-searchable-generative-ai-and-information-diversity-in-online-information-seeking/",
            "copyright_risk": false,
            "manual_check_required": true,
            "prompt_if_ai_image": null
          },
          "image_slots": [],
          "source_urls": [
            "https://www.bbc.com/news/articles/c2023l60370o?at_medium=RSS&at_campaign=rss",
            "https://www.microsoft.com/en-us/research/publication/from-searchable-to-non-searchable-generative-ai-and-information-diversity-in-online-information-seeking/"
          ],
          "image_urls": [],
          "speaker_notes": "[내용] BBC / Royal Observatory article. [보조] Microsoft Research — AI-mediated inquiry and information diversity. [주의] 천문학 비유는 구조 비유로 사용.\n[내용] https://www.bbc.com/news/articles/c2023l60370o?at_medium=RSS&at_campaign=rss\n[내용] https://www.microsoft.com/en-us/research/publication/from-searchable-to-non-searchable-generative-ai-and-information-diversity-in-online-information-seeking/\n[TODO] needs_fact_check=true: claim must be manually checked.",
          "notes": "[내용] BBC / Royal Observatory article. [보조] Microsoft Research — AI-mediated inquiry and information diversity. [주의] 천문학 비유는 구조 비유로 사용.\n[내용] https://www.bbc.com/news/articles/c2023l60370o?at_medium=RSS&at_campaign=rss\n[내용] https://www.microsoft.com/en-us/research/publication/from-searchable-to-non-searchable-generative-ai-and-information-diversity-in-online-information-seeking/\n[TODO] needs_fact_check=true: claim must be manually checked.",
          "needs_source": false,
          "needs_fact_check": true,
          "required_before_broadcast": false,
          "fact_check_kind": null,
          "fact_check_priority": null,
          "risk_flags": [
            "single_source_dependency"
          ],
          "edit_notes": []
        },
        {
          "slide_no": 5,
          "section_no": 1,
          "local_order": 5,
          "source_slide_refs": [
            5
          ],
          "slide_type": "bridge",
          "layout_type": "question",
          "layout": "question",
          "headline": "이 이야기는 천문대만의 이야기가 아니다",
          "body": [
            "학교, 박물관, 도서관, 과학관도 AI가 설명을 대신하는 시대의 질문을 마주한다",
            "UNESCO와 OECD 자료는 AI 교육을 단순 도구 사용이 아니라 역량·원칙의 문제로 다룬다",
            "따라서 핵심은 답 제공 경쟁이 아니라 질문·검증·맥락을 가르치는 역할 변화다"
          ],
          "visual_plan": {
            "kind": "diagram",
            "description": "Simple comparison/question diagram candidate for manual design.",